"Story","Title","Result","Date","Stability","Duration (s)"
"Add User","Add user using correct value","SUCCESS","2022-12-22T18:48:24.536+07:00[Asia/Bangkok]","0.0","12.44"
"Add User","Add user with registered value","SUCCESS","2022-12-22T18:48:38.045+07:00[Asia/Bangkok]","0.0","11.67"
"Add User","Add user using incorrect email","SUCCESS","2022-12-22T18:48:51.207+07:00[Asia/Bangkok]","0.0","11.72"
"Add User","Add user using incorect phone number","SUCCESS","2022-12-22T18:49:04.221+07:00[Asia/Bangkok]","0.0","13.44"
"Add User","Add user with no email","SUCCESS","2022-12-22T18:49:31.96+07:00[Asia/Bangkok]","0.0","11.77"
"Add User","Add user with no phone number","SUCCESS","2022-12-22T18:49:45.16+07:00[Asia/Bangkok]","0.0","11.54"
"Add User","Add user with no password","SUCCESS","2022-12-22T18:49:58.058+07:00[Asia/Bangkok]","0.0","12.17"
